{
  "type": "A.1654653399040a61.FlowToken.TokensWithdrawn",
  "transaction_id": "d1e2f3a4b5c6d1e2f3a4b5c6d1e2f3a4b5c6d1e2f3a4b5c6d1e2f3a4b5c6d1e2",
  "transaction_index": "0",
  "event_index": "0",
  "payload": "eyJ0eXBlIjoiRXZlbnQiLCJ2YWx1ZSI6eyJpZCI6IkEuMTY1NDY1MzM5OTA0MGE2MS5GbG93VG9rZW4uVG9rZW5zV2l0aGRyYXduIiwiZmllbGRzIjpbeyJuYW1lIjoiYW1vdW50IiwidmFsdWUiOnsidHlwZSI6IlVGaXg2NCIsInZhbHVlIjoiMTAuMDAwMDAwMDAifX1dfX0="
}
